No.     Time           Source                Destination           Protocol Length Info
      1 0.000000       172.17.75.57          13.107.42.14          TLSv1.2  2991   Application Data

Frame 1: 2991 bytes on wire (23928 bits), 2991 bytes captured (23928 bits) on interface \Device\NPF_{FDA16086-A7CB-4D35-9E82-2D3616EEEAE1}, id 0
Ethernet II, Src: IntelCor_a3:e4:1d (90:78:41:a3:e4:1d), Dst: Cisco_ff:fd:9c (00:08:e3:ff:fd:9c)
Internet Protocol Version 4, Src: 172.17.75.57, Dst: 13.107.42.14
Transmission Control Protocol, Src Port: 21458, Dst Port: 443, Seq: 1, Ack: 1, Len: 2937
Transport Layer Security
    TLSv1.2 Record Layer: Application Data Protocol: Hypertext Transfer Protocol
        Content Type: Application Data (23)
        Version: TLS 1.2 (0x0303)
        Length: 2932
        Encrypted Application Data: 00000000000001728475ba0d90b8233d8fff59784d5a8156b78841662d7d2fb333da7b03…
        [Application Data Protocol: Hypertext Transfer Protocol]

No.     Time           Source                Destination           Protocol Length Info
      2 0.000276       172.17.75.57          13.107.42.14          TLSv1.2  273    Application Data

Frame 2: 273 bytes on wire (2184 bits), 273 bytes captured (2184 bits) on interface \Device\NPF_{FDA16086-A7CB-4D35-9E82-2D3616EEEAE1}, id 0
Ethernet II, Src: IntelCor_a3:e4:1d (90:78:41:a3:e4:1d), Dst: Cisco_ff:fd:9c (00:08:e3:ff:fd:9c)
Internet Protocol Version 4, Src: 172.17.75.57, Dst: 13.107.42.14
Transmission Control Protocol, Src Port: 21458, Dst Port: 443, Seq: 2938, Ack: 1, Len: 219
Transport Layer Security
    TLSv1.2 Record Layer: Application Data Protocol: Hypertext Transfer Protocol
        Content Type: Application Data (23)
        Version: TLS 1.2 (0x0303)
        Length: 214
        Encrypted Application Data: 00000000000001739eba22a8a98f1b27133642d5fad033914fe42e37be00ef146e1e0056…
        [Application Data Protocol: Hypertext Transfer Protocol]

No.     Time           Source                Destination           Protocol Length Info
      3 0.005674       13.107.42.14          172.17.75.57          TCP      54     443 → 21458 [ACK] Seq=1 Ack=1251 Win=16386 Len=0

Frame 3: 54 bytes on wire (432 bits), 54 bytes captured (432 bits) on interface \Device\NPF_{FDA16086-A7CB-4D35-9E82-2D3616EEEAE1}, id 0
Ethernet II, Src: Cisco_ff:fd:9c (00:08:e3:ff:fd:9c), Dst: IntelCor_a3:e4:1d (90:78:41:a3:e4:1d)
Internet Protocol Version 4, Src: 13.107.42.14, Dst: 172.17.75.57
Transmission Control Protocol, Src Port: 443, Dst Port: 21458, Seq: 1, Ack: 1251, Len: 0

No.     Time           Source                Destination           Protocol Length Info
      4 0.005675       13.107.42.14          172.17.75.57          TCP      54     443 → 21458 [ACK] Seq=1 Ack=3157 Win=16386 Len=0

Frame 4: 54 bytes on wire (432 bits), 54 bytes captured (432 bits) on interface \Device\NPF_{FDA16086-A7CB-4D35-9E82-2D3616EEEAE1}, id 0
Ethernet II, Src: Cisco_ff:fd:9c (00:08:e3:ff:fd:9c), Dst: IntelCor_a3:e4:1d (90:78:41:a3:e4:1d)
Internet Protocol Version 4, Src: 13.107.42.14, Dst: 172.17.75.57
Transmission Control Protocol, Src Port: 443, Dst Port: 21458, Seq: 1, Ack: 3157, Len: 0

No.     Time           Source                Destination           Protocol Length Info
      5 0.100940       13.107.42.14          172.17.75.57          TLSv1.2  237    Application Data

Frame 5: 237 bytes on wire (1896 bits), 237 bytes captured (1896 bits) on interface \Device\NPF_{FDA16086-A7CB-4D35-9E82-2D3616EEEAE1}, id 0
Ethernet II, Src: Cisco_ff:fd:9c (00:08:e3:ff:fd:9c), Dst: IntelCor_a3:e4:1d (90:78:41:a3:e4:1d)
Internet Protocol Version 4, Src: 13.107.42.14, Dst: 172.17.75.57
Transmission Control Protocol, Src Port: 443, Dst Port: 21458, Seq: 1, Ack: 3157, Len: 183
Transport Layer Security
    TLSv1.2 Record Layer: Application Data Protocol: Hypertext Transfer Protocol
        Content Type: Application Data (23)
        Version: TLS 1.2 (0x0303)
        Length: 178
        Encrypted Application Data: 00000000000001cee62b406093054b1e6bb54504278b1bdc7e04a4ba2a6919f93ec43efe…
        [Application Data Protocol: Hypertext Transfer Protocol]

No.     Time           Source                Destination           Protocol Length Info
      6 0.156297       172.17.75.57          13.107.42.14          TCP      54     21458 → 443 [ACK] Seq=3157 Ack=184 Win=255 Len=0

Frame 6: 54 bytes on wire (432 bits), 54 bytes captured (432 bits) on interface \Device\NPF_{FDA16086-A7CB-4D35-9E82-2D3616EEEAE1}, id 0
Ethernet II, Src: IntelCor_a3:e4:1d (90:78:41:a3:e4:1d), Dst: Cisco_ff:fd:9c (00:08:e3:ff:fd:9c)
Internet Protocol Version 4, Src: 172.17.75.57, Dst: 13.107.42.14
Transmission Control Protocol, Src Port: 21458, Dst Port: 443, Seq: 3157, Ack: 184, Len: 0

No.     Time           Source                Destination           Protocol Length Info
      7 0.157832       172.17.75.57          130.113.64.1          DNS      87     Standard query 0x92f7 A BRW40490F6D7713.McMaster.CA

Frame 7: 87 bytes on wire (696 bits), 87 bytes captured (696 bits) on interface \Device\NPF_{FDA16086-A7CB-4D35-9E82-2D3616EEEAE1}, id 0
Ethernet II, Src: IntelCor_a3:e4:1d (90:78:41:a3:e4:1d), Dst: Cisco_ff:fd:9c (00:08:e3:ff:fd:9c)
Internet Protocol Version 4, Src: 172.17.75.57, Dst: 130.113.64.1
User Datagram Protocol, Src Port: 57643, Dst Port: 53
Domain Name System (query)

No.     Time           Source                Destination           Protocol Length Info
      8 0.159740       172.17.75.57          224.0.0.251           MDNS     81     Standard query 0x0000 A BRW40490F6D7713.local, "QM" question

Frame 8: 81 bytes on wire (648 bits), 81 bytes captured (648 bits) on interface \Device\NPF_{FDA16086-A7CB-4D35-9E82-2D3616EEEAE1}, id 0
Ethernet II, Src: IntelCor_a3:e4:1d (90:78:41:a3:e4:1d), Dst: IPv4mcast_fb (01:00:5e:00:00:fb)
Internet Protocol Version 4, Src: 172.17.75.57, Dst: 224.0.0.251
User Datagram Protocol, Src Port: 5353, Dst Port: 5353
Multicast Domain Name System (query)

No.     Time           Source                Destination           Protocol Length Info
      9 0.160924       fe80::bf3d:e61c:c8c4:afa0 ff02::fb              MDNS     101    Standard query 0x0000 A BRW40490F6D7713.local, "QM" question

Frame 9: 101 bytes on wire (808 bits), 101 bytes captured (808 bits) on interface \Device\NPF_{FDA16086-A7CB-4D35-9E82-2D3616EEEAE1}, id 0
Ethernet II, Src: IntelCor_a3:e4:1d (90:78:41:a3:e4:1d), Dst: IPv6mcast_fb (33:33:00:00:00:fb)
Internet Protocol Version 6, Src: fe80::bf3d:e61c:c8c4:afa0, Dst: ff02::fb
User Datagram Protocol, Src Port: 5353, Dst Port: 5353
Multicast Domain Name System (query)

No.     Time           Source                Destination           Protocol Length Info
     10 0.162466       130.113.64.1          172.17.75.57          DNS      150    Standard query response 0x92f7 No such name A BRW40490F6D7713.McMaster.CA SOA pindns01.mcmaster.ca

Frame 10: 150 bytes on wire (1200 bits), 150 bytes captured (1200 bits) on interface \Device\NPF_{FDA16086-A7CB-4D35-9E82-2D3616EEEAE1}, id 0
Ethernet II, Src: Cisco_ff:fd:9c (00:08:e3:ff:fd:9c), Dst: IntelCor_a3:e4:1d (90:78:41:a3:e4:1d)
Internet Protocol Version 4, Src: 130.113.64.1, Dst: 172.17.75.57
User Datagram Protocol, Src Port: 53, Dst Port: 57643
Domain Name System (response)

No.     Time           Source                Destination           Protocol Length Info
     11 0.163250       172.17.75.57          172.17.79.255         NBNS     92     Name query NB BRW40490F6D7713<00>

Frame 11: 92 bytes on wire (736 bits), 92 bytes captured (736 bits) on interface \Device\NPF_{FDA16086-A7CB-4D35-9E82-2D3616EEEAE1}, id 0
Ethernet II, Src: IntelCor_a3:e4:1d (90:78:41:a3:e4:1d), Dst: Broadcast (ff:ff:ff:ff:ff:ff)
Internet Protocol Version 4, Src: 172.17.75.57, Dst: 172.17.79.255
User Datagram Protocol, Src Port: 137, Dst Port: 137
NetBIOS Name Service
    Transaction ID: 0xf827
    Flags: 0x0110, Opcode: Name query, Recursion desired, Broadcast
    Questions: 1
    Answer RRs: 0
    Authority RRs: 0
    Additional RRs: 0
    Queries
        BRW40490F6D7713<00>: type NB, class IN
            Name: BRW40490F6D7713<00> (Workstation/Redirector)
            Type: NB (32)
            Class: IN (1)

No.     Time           Source                Destination           Protocol Length Info
     12 0.164369       172.17.75.57          224.0.0.251           MDNS     81     Standard query 0x0000 A BRW40490F6D7713.local, "QM" question

Frame 12: 81 bytes on wire (648 bits), 81 bytes captured (648 bits) on interface \Device\NPF_{FDA16086-A7CB-4D35-9E82-2D3616EEEAE1}, id 0
Ethernet II, Src: IntelCor_a3:e4:1d (90:78:41:a3:e4:1d), Dst: IPv4mcast_fb (01:00:5e:00:00:fb)
Internet Protocol Version 4, Src: 172.17.75.57, Dst: 224.0.0.251
User Datagram Protocol, Src Port: 5353, Dst Port: 5353
Multicast Domain Name System (query)

No.     Time           Source                Destination           Protocol Length Info
     13 0.165366       fe80::bf3d:e61c:c8c4:afa0 ff02::fb              MDNS     101    Standard query 0x0000 A BRW40490F6D7713.local, "QM" question

Frame 13: 101 bytes on wire (808 bits), 101 bytes captured (808 bits) on interface \Device\NPF_{FDA16086-A7CB-4D35-9E82-2D3616EEEAE1}, id 0
Ethernet II, Src: IntelCor_a3:e4:1d (90:78:41:a3:e4:1d), Dst: IPv6mcast_fb (33:33:00:00:00:fb)
Internet Protocol Version 6, Src: fe80::bf3d:e61c:c8c4:afa0, Dst: ff02::fb
User Datagram Protocol, Src Port: 5353, Dst Port: 5353
Multicast Domain Name System (query)

No.     Time           Source                Destination           Protocol Length Info
     14 0.166713       fe80::bf3d:e61c:c8c4:afa0 ff02::1:3             LLMNR    95     Standard query 0xaa3c A BRW40490F6D7713

Frame 14: 95 bytes on wire (760 bits), 95 bytes captured (760 bits) on interface \Device\NPF_{FDA16086-A7CB-4D35-9E82-2D3616EEEAE1}, id 0
Ethernet II, Src: IntelCor_a3:e4:1d (90:78:41:a3:e4:1d), Dst: IPv6mcast_01:00:03 (33:33:00:01:00:03)
Internet Protocol Version 6, Src: fe80::bf3d:e61c:c8c4:afa0, Dst: ff02::1:3
User Datagram Protocol, Src Port: 53531, Dst Port: 5355
Link-local Multicast Name Resolution (query)

No.     Time           Source                Destination           Protocol Length Info
     15 0.167135       172.17.75.57          224.0.0.252           LLMNR    75     Standard query 0xaa3c A BRW40490F6D7713

Frame 15: 75 bytes on wire (600 bits), 75 bytes captured (600 bits) on interface \Device\NPF_{FDA16086-A7CB-4D35-9E82-2D3616EEEAE1}, id 0
Ethernet II, Src: IntelCor_a3:e4:1d (90:78:41:a3:e4:1d), Dst: IPv4mcast_fc (01:00:5e:00:00:fc)
Internet Protocol Version 4, Src: 172.17.75.57, Dst: 224.0.0.252
User Datagram Protocol, Src Port: 53531, Dst Port: 5355
Link-local Multicast Name Resolution (query)

No.     Time           Source                Destination           Protocol Length Info
     16 0.173371       172.17.75.57          172.217.1.3           TLSv1.2  147    Application Data

Frame 16: 147 bytes on wire (1176 bits), 147 bytes captured (1176 bits) on interface \Device\NPF_{FDA16086-A7CB-4D35-9E82-2D3616EEEAE1}, id 0
Ethernet II, Src: IntelCor_a3:e4:1d (90:78:41:a3:e4:1d), Dst: Cisco_ff:fd:9c (00:08:e3:ff:fd:9c)
Internet Protocol Version 4, Src: 172.17.75.57, Dst: 172.217.1.3
Transmission Control Protocol, Src Port: 15613, Dst Port: 443, Seq: 1, Ack: 1, Len: 93
Transport Layer Security
    TLSv1.2 Record Layer: Application Data Protocol: Hypertext Transfer Protocol
        Content Type: Application Data (23)
        Version: TLS 1.2 (0x0303)
        Length: 88
        Encrypted Application Data: bd297b6f7ecd1c1f7b9525c8fb1082ebf0defbe86dbb4904ace40f52d31800fb3061a77f…
        [Application Data Protocol: Hypertext Transfer Protocol]

No.     Time           Source                Destination           Protocol Length Info
     17 0.179261       172.17.75.57          172.217.1.3           TLSv1.2  147    Application Data

Frame 17: 147 bytes on wire (1176 bits), 147 bytes captured (1176 bits) on interface \Device\NPF_{FDA16086-A7CB-4D35-9E82-2D3616EEEAE1}, id 0
Ethernet II, Src: IntelCor_a3:e4:1d (90:78:41:a3:e4:1d), Dst: Cisco_ff:fd:9c (00:08:e3:ff:fd:9c)
Internet Protocol Version 4, Src: 172.17.75.57, Dst: 172.217.1.3
Transmission Control Protocol, Src Port: 15613, Dst Port: 443, Seq: 94, Ack: 1, Len: 93
Transport Layer Security
    TLSv1.2 Record Layer: Application Data Protocol: Hypertext Transfer Protocol
        Content Type: Application Data (23)
        Version: TLS 1.2 (0x0303)
        Length: 88
        Encrypted Application Data: 7565cca717709d9e4b762fed8b021cd164dfdfc65b535cef81be04965ad36b81f3fb14e6…
        [Application Data Protocol: Hypertext Transfer Protocol]

No.     Time           Source                Destination           Protocol Length Info
     18 0.182952       172.217.1.3           172.17.75.57          TCP      54     443 → 15613 [ACK] Seq=1 Ack=187 Win=267 Len=0

Frame 18: 54 bytes on wire (432 bits), 54 bytes captured (432 bits) on interface \Device\NPF_{FDA16086-A7CB-4D35-9E82-2D3616EEEAE1}, id 0
Ethernet II, Src: Cisco_ff:fd:9c (00:08:e3:ff:fd:9c), Dst: IntelCor_a3:e4:1d (90:78:41:a3:e4:1d)
Internet Protocol Version 4, Src: 172.217.1.3, Dst: 172.17.75.57
Transmission Control Protocol, Src Port: 443, Dst Port: 15613, Seq: 1, Ack: 187, Len: 0

No.     Time           Source                Destination           Protocol Length Info
     19 0.201440       172.217.1.3           172.17.75.57          TLSv1.2  149    Application Data

Frame 19: 149 bytes on wire (1192 bits), 149 bytes captured (1192 bits) on interface \Device\NPF_{FDA16086-A7CB-4D35-9E82-2D3616EEEAE1}, id 0
Ethernet II, Src: 9c:fd:ff:e3:08:00 (9c:fd:ff:e3:08:00), Dst: IntelCor_a3:e4:1d (90:78:41:a3:e4:1d)
Internet Protocol Version 4, Src: 172.217.1.3, Dst: 172.17.75.57
Transmission Control Protocol, Src Port: 443, Dst Port: 15613, Seq: 1, Ack: 187, Len: 95
Transport Layer Security
    TLSv1.2 Record Layer: Application Data Protocol: Hypertext Transfer Protocol
        Content Type: Application Data (23)
        Version: TLS 1.2 (0x0303)
        Length: 90
        Encrypted Application Data: 6f78194be39151fe8f4719cb1bf08168cc7949821befaff4432a4793cad72b568a50d8fc…
        [Application Data Protocol: Hypertext Transfer Protocol]

No.     Time           Source                Destination           Protocol Length Info
     20 0.201442       172.217.1.3           172.17.75.57          TLSv1.2  128    Application Data

Frame 20: 128 bytes on wire (1024 bits), 128 bytes captured (1024 bits) on interface \Device\NPF_{FDA16086-A7CB-4D35-9E82-2D3616EEEAE1}, id 0
Ethernet II, Src: 9c:fd:ff:e3:08:00 (9c:fd:ff:e3:08:00), Dst: IntelCor_a3:e4:1d (90:78:41:a3:e4:1d)
Internet Protocol Version 4, Src: 172.217.1.3, Dst: 172.17.75.57
Transmission Control Protocol, Src Port: 443, Dst Port: 15613, Seq: 96, Ack: 187, Len: 74
Transport Layer Security
    TLSv1.2 Record Layer: Application Data Protocol: Hypertext Transfer Protocol
        Content Type: Application Data (23)
        Version: TLS 1.2 (0x0303)
        Length: 69
        Encrypted Application Data: d3c541bfb457580e9db873a912bb857271ddd6644c708b2f3b82841d6512e992c6caac42…
        [Application Data Protocol: Hypertext Transfer Protocol]

No.     Time           Source                Destination           Protocol Length Info
     21 0.201442       172.217.1.3           172.17.75.57          TLSv1.2  93     Application Data

Frame 21: 93 bytes on wire (744 bits), 93 bytes captured (744 bits) on interface \Device\NPF_{FDA16086-A7CB-4D35-9E82-2D3616EEEAE1}, id 0
Ethernet II, Src: Cisco_ff:fd:9c (00:08:e3:ff:fd:9c), Dst: IntelCor_a3:e4:1d (90:78:41:a3:e4:1d)
Internet Protocol Version 4, Src: 172.217.1.3, Dst: 172.17.75.57
Transmission Control Protocol, Src Port: 443, Dst Port: 15613, Seq: 170, Ack: 187, Len: 39
Transport Layer Security
    TLSv1.2 Record Layer: Application Data Protocol: Hypertext Transfer Protocol
        Content Type: Application Data (23)
        Version: TLS 1.2 (0x0303)
        Length: 34
        Encrypted Application Data: 634f517ba0e0f5ccfc29f7103c74234757e08713d37b29e51ed1505b08905d6ba867
        [Application Data Protocol: Hypertext Transfer Protocol]

No.     Time           Source                Destination           Protocol Length Info
     22 0.201556       172.17.75.57          172.217.1.3           TCP      54     15613 → 443 [ACK] Seq=187 Ack=209 Win=254 Len=0

Frame 22: 54 bytes on wire (432 bits), 54 bytes captured (432 bits) on interface \Device\NPF_{FDA16086-A7CB-4D35-9E82-2D3616EEEAE1}, id 0
Ethernet II, Src: IntelCor_a3:e4:1d (90:78:41:a3:e4:1d), Dst: Cisco_ff:fd:9c (00:08:e3:ff:fd:9c)
Internet Protocol Version 4, Src: 172.17.75.57, Dst: 172.217.1.3
Transmission Control Protocol, Src Port: 15613, Dst Port: 443, Seq: 187, Ack: 209, Len: 0

No.     Time           Source                Destination           Protocol Length Info
     23 0.202477       172.17.75.57          172.217.1.3           TLSv1.2  93     Application Data

Frame 23: 93 bytes on wire (744 bits), 93 bytes captured (744 bits) on interface \Device\NPF_{FDA16086-A7CB-4D35-9E82-2D3616EEEAE1}, id 0
Ethernet II, Src: IntelCor_a3:e4:1d (90:78:41:a3:e4:1d), Dst: Cisco_ff:fd:9c (00:08:e3:ff:fd:9c)
Internet Protocol Version 4, Src: 172.17.75.57, Dst: 172.217.1.3
Transmission Control Protocol, Src Port: 15613, Dst Port: 443, Seq: 187, Ack: 209, Len: 39
Transport Layer Security
    TLSv1.2 Record Layer: Application Data Protocol: Hypertext Transfer Protocol
        Content Type: Application Data (23)
        Version: TLS 1.2 (0x0303)
        Length: 34
        Encrypted Application Data: f81e60024b3d0a0725953e250b4177f714ee4cba0a5371faa6f734183dab00b765b5
        [Application Data Protocol: Hypertext Transfer Protocol]

No.     Time           Source                Destination           Protocol Length Info
     24 0.210197       172.217.1.3           172.17.75.57          TLSv1.2  126    Application Data

Frame 24: 126 bytes on wire (1008 bits), 126 bytes captured (1008 bits) on interface \Device\NPF_{FDA16086-A7CB-4D35-9E82-2D3616EEEAE1}, id 0
Ethernet II, Src: 9c:fd:ff:e3:08:00 (9c:fd:ff:e3:08:00), Dst: IntelCor_a3:e4:1d (90:78:41:a3:e4:1d)
Internet Protocol Version 4, Src: 172.217.1.3, Dst: 172.17.75.57
Transmission Control Protocol, Src Port: 443, Dst Port: 15613, Seq: 209, Ack: 226, Len: 72
Transport Layer Security
    TLSv1.2 Record Layer: Application Data Protocol: Hypertext Transfer Protocol
        Content Type: Application Data (23)
        Version: TLS 1.2 (0x0303)
        Length: 67
        Encrypted Application Data: 0ee60b0182b15a22d0a368908788cb9669707b8f75be176bb9ba46cf6bffaee03ab66498…
        [Application Data Protocol: Hypertext Transfer Protocol]

No.     Time           Source                Destination           Protocol Length Info
     25 0.210199       172.217.1.3           172.17.75.57          TLSv1.2  128    Application Data

Frame 25: 128 bytes on wire (1024 bits), 128 bytes captured (1024 bits) on interface \Device\NPF_{FDA16086-A7CB-4D35-9E82-2D3616EEEAE1}, id 0
Ethernet II, Src: 9c:fd:ff:e3:08:00 (9c:fd:ff:e3:08:00), Dst: IntelCor_a3:e4:1d (90:78:41:a3:e4:1d)
Internet Protocol Version 4, Src: 172.217.1.3, Dst: 172.17.75.57
Transmission Control Protocol, Src Port: 443, Dst Port: 15613, Seq: 281, Ack: 226, Len: 74
Transport Layer Security
    TLSv1.2 Record Layer: Application Data Protocol: Hypertext Transfer Protocol
        Content Type: Application Data (23)
        Version: TLS 1.2 (0x0303)
        Length: 69
        Encrypted Application Data: c6f1aac60d66a3a5e08b338bb9325f19f1147087f2feab238cab64326e6a12a6055941e0…
        [Application Data Protocol: Hypertext Transfer Protocol]

No.     Time           Source                Destination           Protocol Length Info
     26 0.210199       172.217.1.3           172.17.75.57          TLSv1.2  93     Application Data

Frame 26: 93 bytes on wire (744 bits), 93 bytes captured (744 bits) on interface \Device\NPF_{FDA16086-A7CB-4D35-9E82-2D3616EEEAE1}, id 0
Ethernet II, Src: Cisco_ff:fd:9c (00:08:e3:ff:fd:9c), Dst: IntelCor_a3:e4:1d (90:78:41:a3:e4:1d)
Internet Protocol Version 4, Src: 172.217.1.3, Dst: 172.17.75.57
Transmission Control Protocol, Src Port: 443, Dst Port: 15613, Seq: 355, Ack: 226, Len: 39
Transport Layer Security
    TLSv1.2 Record Layer: Application Data Protocol: Hypertext Transfer Protocol
        Content Type: Application Data (23)
        Version: TLS 1.2 (0x0303)
        Length: 34
        Encrypted Application Data: 6a61c8f8fd7902071aa7f333d811b8a439a05ba963321bb56ca904d9184bbedf7d8a
        [Application Data Protocol: Hypertext Transfer Protocol]

No.     Time           Source                Destination           Protocol Length Info
     27 0.210304       172.17.75.57          172.217.1.3           TCP      54     15613 → 443 [ACK] Seq=226 Ack=394 Win=254 Len=0

Frame 27: 54 bytes on wire (432 bits), 54 bytes captured (432 bits) on interface \Device\NPF_{FDA16086-A7CB-4D35-9E82-2D3616EEEAE1}, id 0
Ethernet II, Src: IntelCor_a3:e4:1d (90:78:41:a3:e4:1d), Dst: Cisco_ff:fd:9c (00:08:e3:ff:fd:9c)
Internet Protocol Version 4, Src: 172.17.75.57, Dst: 172.217.1.3
Transmission Control Protocol, Src Port: 15613, Dst Port: 443, Seq: 226, Ack: 394, Len: 0

No.     Time           Source                Destination           Protocol Length Info
     28 0.211256       172.17.75.57          172.217.1.3           TLSv1.2  93     Application Data

Frame 28: 93 bytes on wire (744 bits), 93 bytes captured (744 bits) on interface \Device\NPF_{FDA16086-A7CB-4D35-9E82-2D3616EEEAE1}, id 0
Ethernet II, Src: IntelCor_a3:e4:1d (90:78:41:a3:e4:1d), Dst: Cisco_ff:fd:9c (00:08:e3:ff:fd:9c)
Internet Protocol Version 4, Src: 172.17.75.57, Dst: 172.217.1.3
Transmission Control Protocol, Src Port: 15613, Dst Port: 443, Seq: 226, Ack: 394, Len: 39
Transport Layer Security
    TLSv1.2 Record Layer: Application Data Protocol: Hypertext Transfer Protocol
        Content Type: Application Data (23)
        Version: TLS 1.2 (0x0303)
        Length: 34
        Encrypted Application Data: e66db6166511c0131827c8d64c9a5a21bbc6ceba06105142306219c941eb1681aac3
        [Application Data Protocol: Hypertext Transfer Protocol]

No.     Time           Source                Destination           Protocol Length Info
     29 0.220096       172.217.1.3           172.17.75.57          TCP      54     443 → 15613 [ACK] Seq=394 Ack=265 Win=267 Len=0

Frame 29: 54 bytes on wire (432 bits), 54 bytes captured (432 bits) on interface \Device\NPF_{FDA16086-A7CB-4D35-9E82-2D3616EEEAE1}, id 0
Ethernet II, Src: Cisco_ff:fd:9c (00:08:e3:ff:fd:9c), Dst: IntelCor_a3:e4:1d (90:78:41:a3:e4:1d)
Internet Protocol Version 4, Src: 172.217.1.3, Dst: 172.17.75.57
Transmission Control Protocol, Src Port: 443, Dst Port: 15613, Seq: 394, Ack: 265, Len: 0

No.     Time           Source                Destination           Protocol Length Info
     30 0.234085       172.17.75.57          172.217.1.3           TLSv1.2  156    Application Data

Frame 30: 156 bytes on wire (1248 bits), 156 bytes captured (1248 bits) on interface \Device\NPF_{FDA16086-A7CB-4D35-9E82-2D3616EEEAE1}, id 0
Ethernet II, Src: IntelCor_a3:e4:1d (90:78:41:a3:e4:1d), Dst: Cisco_ff:fd:9c (00:08:e3:ff:fd:9c)
Internet Protocol Version 4, Src: 172.17.75.57, Dst: 172.217.1.3
Transmission Control Protocol, Src Port: 15613, Dst Port: 443, Seq: 265, Ack: 394, Len: 102
Transport Layer Security
    TLSv1.2 Record Layer: Application Data Protocol: Hypertext Transfer Protocol
        Content Type: Application Data (23)
        Version: TLS 1.2 (0x0303)
        Length: 97
        Encrypted Application Data: 240969139ecac89791b19f317628115e8fd69d338891dddc186ce5763ba7fe9187b8f21d…
        [Application Data Protocol: Hypertext Transfer Protocol]

No.     Time           Source                Destination           Protocol Length Info
     31 0.237768       172.217.1.3           172.17.75.57          TCP      54     443 → 15613 [ACK] Seq=394 Ack=367 Win=267 Len=0

Frame 31: 54 bytes on wire (432 bits), 54 bytes captured (432 bits) on interface \Device\NPF_{FDA16086-A7CB-4D35-9E82-2D3616EEEAE1}, id 0
Ethernet II, Src: Cisco_ff:fd:9c (00:08:e3:ff:fd:9c), Dst: IntelCor_a3:e4:1d (90:78:41:a3:e4:1d)
Internet Protocol Version 4, Src: 172.217.1.3, Dst: 172.17.75.57
Transmission Control Protocol, Src Port: 443, Dst Port: 15613, Seq: 394, Ack: 367, Len: 0

No.     Time           Source                Destination           Protocol Length Info
     32 0.261326       172.217.1.3           172.17.75.57          TLSv1.2  126    Application Data

Frame 32: 126 bytes on wire (1008 bits), 126 bytes captured (1008 bits) on interface \Device\NPF_{FDA16086-A7CB-4D35-9E82-2D3616EEEAE1}, id 0
Ethernet II, Src: Cisco_ff:fd:9c (00:08:e3:ff:fd:9c), Dst: IntelCor_a3:e4:1d (90:78:41:a3:e4:1d)
Internet Protocol Version 4, Src: 172.217.1.3, Dst: 172.17.75.57
Transmission Control Protocol, Src Port: 443, Dst Port: 15613, Seq: 394, Ack: 367, Len: 72
Transport Layer Security
    TLSv1.2 Record Layer: Application Data Protocol: Hypertext Transfer Protocol
        Content Type: Application Data (23)
        Version: TLS 1.2 (0x0303)
        Length: 67
        Encrypted Application Data: e4a79522b354b64ce1842d7b3c4b39639e4612cf0f47e77c7bfdfeeeeb3d92b78ca45163…
        [Application Data Protocol: Hypertext Transfer Protocol]

No.     Time           Source                Destination           Protocol Length Info
     33 0.261337       172.217.1.3           172.17.75.57          TLSv1.2  128    Application Data

Frame 33: 128 bytes on wire (1024 bits), 128 bytes captured (1024 bits) on interface \Device\NPF_{FDA16086-A7CB-4D35-9E82-2D3616EEEAE1}, id 0
Ethernet II, Src: 9c:fd:ff:e3:08:00 (9c:fd:ff:e3:08:00), Dst: IntelCor_a3:e4:1d (90:78:41:a3:e4:1d)
Internet Protocol Version 4, Src: 172.217.1.3, Dst: 172.17.75.57
Transmission Control Protocol, Src Port: 443, Dst Port: 15613, Seq: 466, Ack: 367, Len: 74
Transport Layer Security
    TLSv1.2 Record Layer: Application Data Protocol: Hypertext Transfer Protocol
        Content Type: Application Data (23)
        Version: TLS 1.2 (0x0303)
        Length: 69
        Encrypted Application Data: f7d0082c4a796f68980279204dceb8e490b92c10ab629caf43f41f85d31dd6e64a295dd4…
        [Application Data Protocol: Hypertext Transfer Protocol]

No.     Time           Source                Destination           Protocol Length Info
     34 0.261337       172.217.1.3           172.17.75.57          TLSv1.2  85     Application Data

Frame 34: 85 bytes on wire (680 bits), 85 bytes captured (680 bits) on interface \Device\NPF_{FDA16086-A7CB-4D35-9E82-2D3616EEEAE1}, id 0
Ethernet II, Src: 9c:fd:ff:e3:08:00 (9c:fd:ff:e3:08:00), Dst: IntelCor_a3:e4:1d (90:78:41:a3:e4:1d)
Internet Protocol Version 4, Src: 172.217.1.3, Dst: 172.17.75.57
Transmission Control Protocol, Src Port: 443, Dst Port: 15613, Seq: 540, Ack: 367, Len: 31
Transport Layer Security
    TLSv1.2 Record Layer: Application Data Protocol: Hypertext Transfer Protocol
        Content Type: Application Data (23)
        Version: TLS 1.2 (0x0303)
        Length: 26
        Encrypted Application Data: 1342a3f47b8ae0659dcc102d1030529a5d98834a171e7e6b6c84
        [Application Data Protocol: Hypertext Transfer Protocol]

No.     Time           Source                Destination           Protocol Length Info
     35 0.261339       172.217.1.3           172.17.75.57          TLSv1.2  93     Application Data

Frame 35: 93 bytes on wire (744 bits), 93 bytes captured (744 bits) on interface \Device\NPF_{FDA16086-A7CB-4D35-9E82-2D3616EEEAE1}, id 0
Ethernet II, Src: 9c:fd:ff:e3:08:00 (9c:fd:ff:e3:08:00), Dst: IntelCor_a3:e4:1d (90:78:41:a3:e4:1d)
Internet Protocol Version 4, Src: 172.217.1.3, Dst: 172.17.75.57
Transmission Control Protocol, Src Port: 443, Dst Port: 15613, Seq: 571, Ack: 367, Len: 39
Transport Layer Security
    TLSv1.2 Record Layer: Application Data Protocol: Hypertext Transfer Protocol
        Content Type: Application Data (23)
        Version: TLS 1.2 (0x0303)
        Length: 34
        Encrypted Application Data: 6666d0ebac4a4ac29779cc8e2537e84347fd1e511f7b9214e344aeb6a858d30e88ad
        [Application Data Protocol: Hypertext Transfer Protocol]

No.     Time           Source                Destination           Protocol Length Info
     36 0.261496       172.17.75.57          172.217.1.3           TCP      54     15613 → 443 [ACK] Seq=367 Ack=610 Win=258 Len=0

Frame 36: 54 bytes on wire (432 bits), 54 bytes captured (432 bits) on interface \Device\NPF_{FDA16086-A7CB-4D35-9E82-2D3616EEEAE1}, id 0
Ethernet II, Src: IntelCor_a3:e4:1d (90:78:41:a3:e4:1d), Dst: Cisco_ff:fd:9c (00:08:e3:ff:fd:9c)
Internet Protocol Version 4, Src: 172.17.75.57, Dst: 172.217.1.3
Transmission Control Protocol, Src Port: 15613, Dst Port: 443, Seq: 367, Ack: 610, Len: 0

No.     Time           Source                Destination           Protocol Length Info
     37 0.262300       172.17.75.57          172.217.1.3           TLSv1.2  93     Application Data

Frame 37: 93 bytes on wire (744 bits), 93 bytes captured (744 bits) on interface \Device\NPF_{FDA16086-A7CB-4D35-9E82-2D3616EEEAE1}, id 0
Ethernet II, Src: IntelCor_a3:e4:1d (90:78:41:a3:e4:1d), Dst: Cisco_ff:fd:9c (00:08:e3:ff:fd:9c)
Internet Protocol Version 4, Src: 172.17.75.57, Dst: 172.217.1.3
Transmission Control Protocol, Src Port: 15613, Dst Port: 443, Seq: 367, Ack: 610, Len: 39
Transport Layer Security
    TLSv1.2 Record Layer: Application Data Protocol: Hypertext Transfer Protocol
        Content Type: Application Data (23)
        Version: TLS 1.2 (0x0303)
        Length: 34
        Encrypted Application Data: 1fadc69e6d83ba339b27d511a9acbe1cd8ecccfc99ae68bf3afc373f0e3f3a9cf1b2
        [Application Data Protocol: Hypertext Transfer Protocol]

No.     Time           Source                Destination           Protocol Length Info
     38 0.271417       172.217.1.3           172.17.75.57          TCP      54     443 → 15613 [ACK] Seq=610 Ack=406 Win=267 Len=0

Frame 38: 54 bytes on wire (432 bits), 54 bytes captured (432 bits) on interface \Device\NPF_{FDA16086-A7CB-4D35-9E82-2D3616EEEAE1}, id 0
Ethernet II, Src: Cisco_ff:fd:9c (00:08:e3:ff:fd:9c), Dst: IntelCor_a3:e4:1d (90:78:41:a3:e4:1d)
Internet Protocol Version 4, Src: 172.217.1.3, Dst: 172.17.75.57
Transmission Control Protocol, Src Port: 443, Dst Port: 15613, Seq: 610, Ack: 406, Len: 0

No.     Time           Source                Destination           Protocol Length Info
     39 0.425958       172.17.75.57          31.13.80.6            TLSv1.2  83     Application Data

Frame 39: 83 bytes on wire (664 bits), 83 bytes captured (664 bits) on interface \Device\NPF_{FDA16086-A7CB-4D35-9E82-2D3616EEEAE1}, id 0
Ethernet II, Src: IntelCor_a3:e4:1d (90:78:41:a3:e4:1d), Dst: Cisco_ff:fd:9c (00:08:e3:ff:fd:9c)
Internet Protocol Version 4, Src: 172.17.75.57, Dst: 31.13.80.6
Transmission Control Protocol, Src Port: 21488, Dst Port: 443, Seq: 1, Ack: 1, Len: 29
Transport Layer Security
    TLSv1.2 Record Layer: Application Data Protocol: Hypertext Transfer Protocol
        Content Type: Application Data (23)
        Version: TLS 1.2 (0x0303)
        Length: 24
        Encrypted Application Data: 31b1b1166a02d689e64b76c7a27afba47d2085455127b56f
        [Application Data Protocol: Hypertext Transfer Protocol]

No.     Time           Source                Destination           Protocol Length Info
     40 0.449038       31.13.80.6            172.17.75.57          TLSv1.2  79     Application Data

Frame 40: 79 bytes on wire (632 bits), 79 bytes captured (632 bits) on interface \Device\NPF_{FDA16086-A7CB-4D35-9E82-2D3616EEEAE1}, id 0
Ethernet II, Src: Cisco_ff:fd:9c (00:08:e3:ff:fd:9c), Dst: IntelCor_a3:e4:1d (90:78:41:a3:e4:1d)
Internet Protocol Version 4, Src: 31.13.80.6, Dst: 172.17.75.57
Transmission Control Protocol, Src Port: 443, Dst Port: 21488, Seq: 1, Ack: 30, Len: 25
Transport Layer Security
    TLSv1.2 Record Layer: Application Data Protocol: Hypertext Transfer Protocol
        Content Type: Application Data (23)
        Version: TLS 1.2 (0x0303)
        Length: 20
        Encrypted Application Data: 4c07d07c81c876770496182961fb83bddd3ecdd1
        [Application Data Protocol: Hypertext Transfer Protocol]

No.     Time           Source                Destination           Protocol Length Info
     41 0.501727       172.17.75.57          31.13.80.6            TCP      54     21488 → 443 [ACK] Seq=30 Ack=26 Win=257 Len=0

Frame 41: 54 bytes on wire (432 bits), 54 bytes captured (432 bits) on interface \Device\NPF_{FDA16086-A7CB-4D35-9E82-2D3616EEEAE1}, id 0
Ethernet II, Src: IntelCor_a3:e4:1d (90:78:41:a3:e4:1d), Dst: Cisco_ff:fd:9c (00:08:e3:ff:fd:9c)
Internet Protocol Version 4, Src: 172.17.75.57, Dst: 31.13.80.6
Transmission Control Protocol, Src Port: 21488, Dst Port: 443, Seq: 30, Ack: 26, Len: 0

No.     Time           Source                Destination           Protocol Length Info
     42 0.592551       fe80::bf3d:e61c:c8c4:afa0 ff02::1:3             LLMNR    95     Standard query 0xaa3c A BRW40490F6D7713

Frame 42: 95 bytes on wire (760 bits), 95 bytes captured (760 bits) on interface \Device\NPF_{FDA16086-A7CB-4D35-9E82-2D3616EEEAE1}, id 0
Ethernet II, Src: IntelCor_a3:e4:1d (90:78:41:a3:e4:1d), Dst: IPv6mcast_01:00:03 (33:33:00:01:00:03)
Internet Protocol Version 6, Src: fe80::bf3d:e61c:c8c4:afa0, Dst: ff02::1:3
User Datagram Protocol, Src Port: 53531, Dst Port: 5355
Link-local Multicast Name Resolution (query)

No.     Time           Source                Destination           Protocol Length Info
     43 0.592826       172.17.75.57          224.0.0.252           LLMNR    75     Standard query 0xaa3c A BRW40490F6D7713

Frame 43: 75 bytes on wire (600 bits), 75 bytes captured (600 bits) on interface \Device\NPF_{FDA16086-A7CB-4D35-9E82-2D3616EEEAE1}, id 0
Ethernet II, Src: IntelCor_a3:e4:1d (90:78:41:a3:e4:1d), Dst: IPv4mcast_fc (01:00:5e:00:00:fc)
Internet Protocol Version 4, Src: 172.17.75.57, Dst: 224.0.0.252
User Datagram Protocol, Src Port: 53531, Dst Port: 5355
Link-local Multicast Name Resolution (query)

No.     Time           Source                Destination           Protocol Length Info
     44 0.744392       Cisco_8b:3c:3f        Broadcast             ARP      42     Gratuitous ARP for 172.17.77.129 (Reply)

Frame 44: 42 bytes on wire (336 bits), 42 bytes captured (336 bits) on interface \Device\NPF_{FDA16086-A7CB-4D35-9E82-2D3616EEEAE1}, id 0
Ethernet II, Src: Cisco_8b:3c:3f (00:ea:bd:8b:3c:3f), Dst: Broadcast (ff:ff:ff:ff:ff:ff)
Address Resolution Protocol (reply/gratuitous ARP)

No.     Time           Source                Destination           Protocol Length Info
     45 0.924808       172.17.75.57          172.17.79.255         NBNS     92     Name query NB BRW40490F6D7713<00>

Frame 45: 92 bytes on wire (736 bits), 92 bytes captured (736 bits) on interface \Device\NPF_{FDA16086-A7CB-4D35-9E82-2D3616EEEAE1}, id 0
Ethernet II, Src: IntelCor_a3:e4:1d (90:78:41:a3:e4:1d), Dst: Broadcast (ff:ff:ff:ff:ff:ff)
Internet Protocol Version 4, Src: 172.17.75.57, Dst: 172.17.79.255
User Datagram Protocol, Src Port: 137, Dst Port: 137
NetBIOS Name Service
    Transaction ID: 0xf827
    Flags: 0x0110, Opcode: Name query, Recursion desired, Broadcast
    Questions: 1
    Answer RRs: 0
    Authority RRs: 0
    Additional RRs: 0
    Queries
        BRW40490F6D7713<00>: type NB, class IN
            Name: BRW40490F6D7713<00> (Workstation/Redirector)
            Type: NB (32)
            Class: IN (1)

No.     Time           Source                Destination           Protocol Length Info
     46 1.163757       172.17.75.57          224.0.0.251           MDNS     81     Standard query 0x0000 A BRW40490F6D7713.local, "QM" question

Frame 46: 81 bytes on wire (648 bits), 81 bytes captured (648 bits) on interface \Device\NPF_{FDA16086-A7CB-4D35-9E82-2D3616EEEAE1}, id 0
Ethernet II, Src: IntelCor_a3:e4:1d (90:78:41:a3:e4:1d), Dst: IPv4mcast_fb (01:00:5e:00:00:fb)
Internet Protocol Version 4, Src: 172.17.75.57, Dst: 224.0.0.251
User Datagram Protocol, Src Port: 5353, Dst Port: 5353
Multicast Domain Name System (query)

No.     Time           Source                Destination           Protocol Length Info
     47 1.164614       fe80::bf3d:e61c:c8c4:afa0 ff02::fb              MDNS     101    Standard query 0x0000 A BRW40490F6D7713.local, "QM" question

Frame 47: 101 bytes on wire (808 bits), 101 bytes captured (808 bits) on interface \Device\NPF_{FDA16086-A7CB-4D35-9E82-2D3616EEEAE1}, id 0
Ethernet II, Src: IntelCor_a3:e4:1d (90:78:41:a3:e4:1d), Dst: IPv6mcast_fb (33:33:00:00:00:fb)
Internet Protocol Version 6, Src: fe80::bf3d:e61c:c8c4:afa0, Dst: ff02::fb
User Datagram Protocol, Src Port: 5353, Dst Port: 5353
Multicast Domain Name System (query)

No.     Time           Source                Destination           Protocol Length Info
     48 1.176422       172.17.75.57          224.0.0.251           MDNS     81     Standard query 0x0000 A BRW40490F6D7713.local, "QM" question

Frame 48: 81 bytes on wire (648 bits), 81 bytes captured (648 bits) on interface \Device\NPF_{FDA16086-A7CB-4D35-9E82-2D3616EEEAE1}, id 0
Ethernet II, Src: IntelCor_a3:e4:1d (90:78:41:a3:e4:1d), Dst: IPv4mcast_fb (01:00:5e:00:00:fb)
Internet Protocol Version 4, Src: 172.17.75.57, Dst: 224.0.0.251
User Datagram Protocol, Src Port: 5353, Dst Port: 5353
Multicast Domain Name System (query)

No.     Time           Source                Destination           Protocol Length Info
     49 1.177214       fe80::bf3d:e61c:c8c4:afa0 ff02::fb              MDNS     101    Standard query 0x0000 A BRW40490F6D7713.local, "QM" question

Frame 49: 101 bytes on wire (808 bits), 101 bytes captured (808 bits) on interface \Device\NPF_{FDA16086-A7CB-4D35-9E82-2D3616EEEAE1}, id 0
Ethernet II, Src: IntelCor_a3:e4:1d (90:78:41:a3:e4:1d), Dst: IPv6mcast_fb (33:33:00:00:00:fb)
Internet Protocol Version 6, Src: fe80::bf3d:e61c:c8c4:afa0, Dst: ff02::fb
User Datagram Protocol, Src Port: 5353, Dst Port: 5353
Multicast Domain Name System (query)

No.     Time           Source                Destination           Protocol Length Info
     50 1.238160       13.107.42.14          172.17.75.57          TLSv1.2  100    Application Data

Frame 50: 100 bytes on wire (800 bits), 100 bytes captured (800 bits) on interface \Device\NPF_{FDA16086-A7CB-4D35-9E82-2D3616EEEAE1}, id 0
Ethernet II, Src: Cisco_ff:fd:9c (00:08:e3:ff:fd:9c), Dst: IntelCor_a3:e4:1d (90:78:41:a3:e4:1d)
Internet Protocol Version 4, Src: 13.107.42.14, Dst: 172.17.75.57
Transmission Control Protocol, Src Port: 443, Dst Port: 21458, Seq: 184, Ack: 3157, Len: 46
Transport Layer Security
    TLSv1.2 Record Layer: Application Data Protocol: Hypertext Transfer Protocol
        Content Type: Application Data (23)
        Version: TLS 1.2 (0x0303)
        Length: 41
        Encrypted Application Data: 00000000000001cfd0e6e0edd582e20dd79040c698d34c25be9cbcb562f2986cdad73d28…
        [Application Data Protocol: Hypertext Transfer Protocol]

No.     Time           Source                Destination           Protocol Length Info
     51 1.287683       172.17.75.57          13.107.42.14          TCP      54     21458 → 443 [ACK] Seq=3157 Ack=230 Win=255 Len=0

Frame 51: 54 bytes on wire (432 bits), 54 bytes captured (432 bits) on interface \Device\NPF_{FDA16086-A7CB-4D35-9E82-2D3616EEEAE1}, id 0
Ethernet II, Src: IntelCor_a3:e4:1d (90:78:41:a3:e4:1d), Dst: Cisco_ff:fd:9c (00:08:e3:ff:fd:9c)
